{
  "schemaVersion": 1,
  "signatureId": "gate6-game-end",
  "subject": {
    "path": "contracts/state-transition/game_end_contract_v1.json",
    "digest": "sha256:e93f30f75b97f580d3ee0984ff4300bb7a35544a4568a0fedfabf32da81e1ec4"
  },
  "artifactAuthorId": "codex",
  "recordedReviewerId": "山田正輝",
  "recordedOn": "2026-10-21",
  "reviewScope": "【旧確認履歴: 2026-10-15、対象digest sha256:3514e1c6225f3a4da4ebf960d918388508a2d1c72ce02ddb4df0af0de0f77863】TSK-538 ステップ 22〜32 で追加・変更した終了判定の規範行 8 行(GAME-END-NORMAL・GAME-END-EXTRA-CONTINUE・GAME-END-LIMIT-DRAW・GAME-END-TIEBREAK-CONTINUE・COLD-08・COLD-09・GAME-END-WALK-OFF・XMARK-02)と派生 case 248 件。逐行確認シート docs/features/adr003-stage2-runtime/step33_line_review.md(SHA-256 9041f14c4b2a7d06440bb1278e31e8fe48e03f1ebedaa352a5b25685b62b1325)の終了判定の節。条文が決めていない点(未解消レポートの G6-E01〜E14)は確認の範囲外で、TSK-545 へ送った。確認の順序: 作成者 codex が規範行と派生 case を作り、逐行確認シートを機械生成した。Claude が要件書・ADR-003 v0.7 から期待値を先に導いてシートと照合し、条文と食い違う期待値を是正させた(突合表 docs/features/adr003-stage2-runtime/gate6-crosscheck.md)。記録上の確認者は、作成者の作業結果と Claude の突合表を見た後に、要件書の条文を直接照合して承認した(作成者の作業結果を見る前に条文を読んだとは記録しない)。 【今回の限定再署名: 実施日2026-10-21】確認者は山田正輝。本会話の本人回答「確認範囲：T2契約へのprovenance追加のみ」「追加provenanceとD1〜D4を確認し、この範囲で再署名します」「確認方法：目視」「実施日：20261021」に基づき転記した。重複した署名者表記は1件に整理し、日付はISO形式へ正規化した。対象はT2現物digest sha256:e93f30f75b97f580d3ee0984ff4300bb7a35544a4568a0fedfabf32da81e1ec4。provenanceの中身の起案はTSK-545の子カード、器と記入はClaude(538)。規範行8行・派生case248件・拒否入力12件は旧確認対象から不変で、provenance除去後RFC8785 digestが旧署名digestと一致することをD1〜D4で機械照合した。今回の実方法は目視であり、recordedMethodと既存の直接条文照合宣誓は上記旧規範行の確認履歴として保持し、今回新たな条文独立導出を実施したとは記録しない。P-6独立検証、正式DRAW/GAP-05の承認、所有側受理は今回の範囲に含めない。",
  "recordedMethod": "direct-clause-comparison",
  "attestations": [
    {
      "attestationId": "direct-clause-review-declared",
      "recordedResponse": true
    }
  ]
}
