{
  "schemaVersion": 1,
  "signatureId": "gate6-state-transition",
  "subject": {
    "path": "contracts/state-transition/state_transition_contract_v1.json",
    "digest": "sha256:286c2fe8dcf71cf78c78df0432cd19dfe35208656c80c39377891dc32fd451fd"
  },
  "artifactAuthorId": "codex",
  "recordedReviewerId": "山田正輝",
  "recordedOn": "2026-10-15",
  "reviewScope": "TSK-538 ステップ 22〜32 で追加・変更した状況判定の operationRows 10 行(既存 7 行の履歴と結果の面の移行・tiebreak-start 3 行)と undoRows 10 行、およびそれらの派生 case 20 件。逐行確認シート docs/features/adr003-stage2-runtime/step33_line_review.md(SHA-256 9041f14c4b2a7d06440bb1278e31e8fe48e03f1ebedaa352a5b25685b62b1325)の状況判定の節。既存の matrixRows は確認の範囲外(契約の provenance は not-performed のまま)。条文が決めていない点(未解消レポートの G6-S01〜S11)は範囲外で、TSK-544 へ送った。確認の順序: 作成者 codex が規範行と派生 case を作り、逐行確認シートを機械生成した。Claude が要件書・ADR-003 v0.7 から期待値を先に導いてシートと照合し、条文と食い違う期待値を是正させた(突合表 docs/features/adr003-stage2-runtime/gate6-crosscheck.md)。記録上の確認者は、作成者の作業結果と Claude の突合表を見た後に、要件書の条文を直接照合して承認した(作成者の作業結果を見る前に条文を読んだとは記録しない)。",
  "recordedMethod": "direct-clause-comparison",
  "attestations": [
    {
      "attestationId": "direct-clause-review-declared",
      "recordedResponse": true
    }
  ]
}
